{
  "card_id": "triangle_correlation|EURGBP|3M triangle vs EURUSD/GBPUSD (sell cross vol / buy leg vols)",
  "headline": "3M triangle vs EURUSD/GBPUSD (sell cross vol / buy leg vols): sell_corr z +7.1",
  "pair": "EURGBP",
  "band": "WATCH",
  "findings": "",
  "invalidation": [
    "implied-realized corr gap < 0.15",
    "leg correlation regime shift"
  ],
  "workspace_brief": "G10 RV \u2014 curve trades preferred",
  "evidence": [
    {
      "eid": "E1",
      "label": "z-score",
      "value": "+7.07",
      "provenance": "packet.signals[0].score",
      "tag": "supporting"
    },
    {
      "eid": "E2",
      "label": "edge estimate",
      "value": "+7.38vp",
      "provenance": "packet.signals[0].edge_estimate_volpts",
      "tag": "supporting"
    },
    {
      "eid": "E3",
      "label": "model disagreement",
      "value": "SABR/SSVI diverge 4.3vp",
      "provenance": "packet.health.EURGBP.model_divergence_worst.volpts",
      "tag": "contradiction"
    },
    {
      "eid": "E4",
      "label": "same family elsewhere (EURJPY)",
      "value": "3M triangle vs EURUSD/USDJPY (buy cross vol / sell leg vols): buy_corr z -3.8",
      "provenance": "derived:card(triangle_correlation|EURJPY|3M triangle vs EURUSD/USDJPY (buy cross vol / sell leg vols))",
      "tag": "context"
    },
    {
      "eid": "E5",
      "label": "co-signal vol_risk_premium",
      "value": "3M ATM (delta-hedged): sell_vol z +3.2",
      "provenance": "derived:card(vol_risk_premium|EURGBP|3M ATM (delta-hedged))",
      "tag": "supporting"
    },
    {
      "eid": "E6",
      "label": "co-signal SURFACE_RICH",
      "value": "rr25 rich across 3 tenors (lead 6M p99)",
      "provenance": "derived:card(SKEW_PCTILE|EURGBP|*)",
      "tag": "supporting"
    },
    {
      "eid": "E7",
      "label": "co-signal SURFACE_RICH",
      "value": "atm rich across 5 tenors (lead 6M p96)",
      "provenance": "derived:card(ATM_PCTILE|EURGBP|*)",
      "tag": "supporting"
    },
    {
      "eid": "E8",
      "label": "co-signal vol_risk_premium",
      "value": "6M ATM (delta-hedged): sell_vol z +3.6",
      "provenance": "derived:card(vol_risk_premium|EURGBP|6M ATM (delta-hedged))",
      "tag": "supporting"
    },
    {
      "eid": "E9",
      "label": "co-signal skew_richcheap",
      "value": "1M 25d risk reversal: sell_skew z +2.4",
      "provenance": "derived:card(skew_richcheap|EURGBP|1M 25d risk reversal)",
      "tag": "supporting"
    },
    {
      "eid": "E10",
      "label": "co-signal SKEW_PCTILE",
      "value": "1M rr25 at p100 of stored history",
      "provenance": "derived:card(SKEW_PCTILE|EURGBP|1M)",
      "tag": "supporting"
    },
    {
      "eid": "E11",
      "label": "co-signal SKEW_PCTILE",
      "value": "ON rr25 at p4 of stored history",
      "provenance": "derived:card(SKEW_PCTILE|EURGBP|ON)",
      "tag": "supporting"
    },
    {
      "eid": "E12",
      "label": "SABR/SSVI worst divergence",
      "value": "4.28vp",
      "provenance": "packet.health.EURGBP.model_divergence_worst.volpts",
      "tag": "contradiction"
    },
    {
      "eid": "E13",
      "label": "prior episode triangle_correlation|EURJPY|3M triangle vs EURUSD/USDJPY (buy cross vol / sell leg vols)",
      "value": "new \u2192 new",
      "provenance": "ledger:card(triangle_correlation|EURJPY|3M triangle vs EURUSD/USDJPY (buy cross vol / sell leg vols))",
      "tag": "ledger"
    },
    {
      "eid": "E14",
      "label": "triangle_correlation funnel to date",
      "value": "2 generated / 1 acted / 0 dismissed / 0 invalidated",
      "provenance": "ledger:funnel(triangle_correlation)",
      "tag": "ledger"
    }
  ]
}